[
  { "slug": "makeboluo", "name": "马可波罗", "aliases": ["Marco Polo", "马可波罗瓷砖"], "categories": ["瓷砖"], "tier": "premium", "one_liner": "国产瓷砖一线品牌，仿古砖起家，产品线全、渠道广。", "country": "中国", "source": "seed", "confidence": 1 },
  { "slug": "dongpeng", "name": "东鹏", "aliases": ["东鹏瓷砖", "DONGPENG"], "categories": ["瓷砖"], "tier": "premium", "one_liner": "老牌国产一线瓷砖，性价比与稳定性口碑好。", "country": "中国", "source": "seed", "confidence": 1 },
  { "slug": "oushennuo", "name": "欧神诺", "aliases": ["Oceano"], "categories": ["瓷砖"], "tier": "mainstream", "one_liner": "帝欧家居旗下瓷砖品牌，主流档，整装渠道常见。", "country": "中国", "source": "seed", "confidence": 1 },
  { "slug": "mengnalisha", "name": "蒙娜丽莎", "aliases": ["Monalisa", "蒙娜丽莎瓷砖"], "categories": ["瓷砖"], "tier": "premium", "one_liner": "国产一线瓷砖，岩板/大板品类有优势。", "country": "中国", "source": "seed", "confidence": 1 },
  { "slug": "dongfang-yuhong", "name": "东方雨虹", "aliases": ["雨虹", "YUHONG"], "categories": ["防水", "腻子", "辅材"], "tier": "premium", "one_liner": "国内防水建材龙头，民用防水与腻子基层标配级品牌。", "country": "中国", "source": "seed", "confidence": 1 },
  { "slug": "xika", "name": "西卡", "aliases": ["Sika"], "categories": ["防水", "辅材"], "tier": "luxury", "one_liner": "瑞士百年建筑化工品牌，防水/密封胶高端之选。", "country": "瑞士", "source": "seed", "confidence": 1 },
  { "slug": "duoleshi", "name": "多乐士", "aliases": ["Dulux"], "categories": ["乳胶漆"], "tier": "premium", "one_liner": "阿克苏诺贝尔旗下涂料品牌，家装乳胶漆一线主力。", "country": "荷兰", "source": "seed", "confidence": 1 },
  { "slug": "jiabaoli", "name": "嘉宝莉", "aliases": ["Carpoly"], "categories": ["乳胶漆"], "tier": "mainstream", "one_liner": "国产涂料头部品牌，主流档乳胶漆常见选择。", "country": "中国", "source": "seed", "confidence": 1 },
  { "slug": "tata", "name": "TATA", "aliases": ["TATA木门", "tata"], "categories": ["木门"], "tier": "premium", "one_liner": "国内木门零售第一梯队，静音门体系出名；套餐里能选到 TATA 通常是加分项。", "country": "中国", "source": "seed", "confidence": 1 },
  { "slug": "shengsheng-gainian", "name": "升升概念", "aliases": [], "categories": ["木门"], "tier": "mainstream", "one_liner": "整装渠道常见木门品牌，主流档。", "country": "中国", "source": "seed", "confidence": 1 },
  { "slug": "jiangshan-oupai", "name": "江山欧派", "aliases": ["欧派门(江山)"], "categories": ["木门"], "tier": "premium", "one_liner": "上市木门企业，工程与零售量大，注意与『欧派家居』不是一家。", "country": "中国", "source": "seed", "confidence": 1 },
  { "slug": "padi-men", "name": "派的门", "aliases": ["PADI"], "categories": ["木门"], "tier": "mainstream", "one_liner": "圣象集团旗下木门品牌，简约风格，主流偏上。", "country": "中国", "source": "seed", "confidence": 1 },
  { "slug": "feilipu", "name": "飞利浦", "aliases": ["Philips"], "categories": ["电线", "照明"], "tier": "premium", "one_liner": "国际品牌授权的家装电线，品牌溢价明显，品质稳定。", "country": "荷兰", "source": "seed", "confidence": 1 },
  { "slug": "zhongda-yuantong", "name": "中大元通", "aliases": ["元通电缆"], "categories": ["电线"], "tier": "mainstream", "one_liner": "浙江本地主流电缆品牌，杭州整装常用。", "country": "中国", "source": "seed", "confidence": 1 },
  { "slug": "dongfang-dianlan", "name": "东方电缆", "aliases": [], "categories": ["电线"], "tier": "mainstream", "one_liner": "上市电缆企业，家装线为民用产品线。", "country": "中国", "source": "seed", "confidence": 1 },
  { "slug": "yongding", "name": "永鼎", "aliases": ["永鼎线缆"], "categories": ["电线", "弱电"], "tier": "mainstream", "one_liner": "江苏老牌线缆企业，弱电线常见。", "country": "中国", "source": "seed", "confidence": 1 },
  { "slug": "weixing", "name": "伟星", "aliases": ["伟星管", "VASEN"], "categories": ["水管", "辅材"], "tier": "premium", "one_liner": "PPR 管零售龙头，服务体系（星管家）完善。", "country": "中国", "source": "seed", "confidence": 1 },
  { "slug": "rifeng", "name": "日丰", "aliases": ["RIFENG"], "categories": ["水管", "辅材"], "tier": "premium", "one_liner": "管道大厂，PPR/铝塑管全线覆盖，一线档。", "country": "中国", "source": "seed", "confidence": 1 },
  { "slug": "gongyuan", "name": "公元", "aliases": ["ERA", "公元管道"], "categories": ["水管", "辅材"], "tier": "mainstream", "one_liner": "上市管道企业，工程量大，主流档。", "country": "中国", "source": "seed", "confidence": 1 },
  { "slug": "ximenzi", "name": "西门子", "aliases": ["Siemens"], "categories": ["开关插座"], "tier": "premium", "one_liner": "开关插座外资一线，睿致/致典系列家装常见。", "country": "德国", "source": "seed", "confidence": 1 },
  { "slug": "zhibang", "name": "志邦", "aliases": ["志邦家居", "ZBOM"], "categories": ["全屋定制", "橱柜"], "tier": "premium", "one_liner": "上市定制家居企业，橱柜起家，全屋定制一线梯队。", "country": "中国", "source": "seed", "confidence": 1 },
  { "slug": "jinpai", "name": "金牌", "aliases": ["金牌厨柜", "金牌主厨"], "categories": ["全屋定制", "橱柜"], "tier": "premium", "one_liner": "上市橱柜品牌，厨房定制见长，全屋定制一线梯队。", "country": "中国", "source": "seed", "confidence": 1 },
  { "slug": "moganshan", "name": "莫干山", "aliases": ["莫干山板材"], "categories": ["全屋定制", "板材", "地板"], "tier": "mainstream", "one_liner": "升华云峰旗下板材品牌，环保板材口碑好，定制/地板均有产品线。", "country": "中国", "source": "seed", "confidence": 1 },
  { "slug": "tubaobao", "name": "兔宝宝", "aliases": ["Tubao"], "categories": ["全屋定制", "板材"], "tier": "mainstream", "one_liner": "板材上市公司，环保等级宣传力度大，定制基材常见。", "country": "中国", "source": "seed", "confidence": 1 },
  { "slug": "aopu", "name": "奥普", "aliases": ["AUPU"], "categories": ["集成吊顶", "浴霸"], "tier": "premium", "one_liner": "浴霸/集成吊顶头部品牌，厨卫吊顶电器一线。", "country": "中国", "source": "seed", "confidence": 1 },
  { "slug": "meidi", "name": "美的", "aliases": ["Midea"], "categories": ["集成吊顶", "厨电"], "tier": "premium", "one_liner": "家电巨头，吊顶电器/厨电产品线齐全。", "country": "中国", "source": "seed", "confidence": 1 },
  { "slug": "chuzhibao", "name": "厨之宝", "aliases": [], "categories": ["台面"], "tier": "mainstream", "one_liner": "石英石台面供应商，整装渠道常见。", "country": "中国", "source": "seed", "confidence": 1 },
  { "slug": "oubali", "name": "欧铂利", "aliases": [], "categories": ["台面"], "tier": "mainstream", "one_liner": "欧派体系台面品牌，石英石台面主流选择。", "country": "中国", "source": "seed", "confidence": 1 },
  { "slug": "oulin", "name": "欧琳", "aliases": ["OULIN"], "categories": ["水槽", "龙头"], "tier": "premium", "one_liner": "水槽头部品牌，不锈钢水槽一线。", "country": "中国", "source": "seed", "confidence": 1 },
  { "slug": "nuodima", "name": "诺帝玛", "aliases": ["NUODIMA"], "categories": ["水槽", "龙头"], "tier": "mainstream", "one_liner": "水槽/龙头主流品牌，整装套餐常见。", "country": "中国", "source": "seed", "confidence": 1 },
  { "slug": "kadi", "name": "卡帝", "aliases": [], "categories": ["金属移门"], "tier": "mainstream", "one_liner": "极窄边框金属移门品牌，厨卫移门常用。", "country": "中国", "source": "seed", "confidence": 1 },
  { "slug": "denuoke", "name": "德诺克", "aliases": ["德诺克(梵)"], "categories": ["金属移门"], "tier": "mainstream", "one_liner": "金属移门/淋浴隔断品牌，整装渠道常见。", "country": "中国", "source": "seed", "confidence": 1 },
  { "slug": "deer", "name": "德尔", "aliases": ["Der", "德尔地板"], "categories": ["地板"], "tier": "premium", "one_liner": "强化/复合地板一线品牌，环保锁扣技术起家。", "country": "中国", "source": "seed", "confidence": 1 },
  { "slug": "shuxiang-mendi", "name": "书香门地", "aliases": ["书香门第"], "categories": ["地板"], "tier": "premium", "one_liner": "美学地板定位，实木复合见长，一线偏上。", "country": "中国", "source": "seed", "confidence": 1 },
  { "slug": "daziran", "name": "大自然", "aliases": ["Nature", "大自然地板"], "categories": ["地板"], "tier": "premium", "one_liner": "地板一线品牌，实木/实木复合产品线全。", "country": "中国", "source": "seed", "confidence": 1 },
  { "slug": "qianshuiting", "name": "潜水艇", "aliases": ["Submarine"], "categories": ["地漏", "五金"], "tier": "premium", "one_liner": "地漏品类代名词级品牌，防臭芯专利多。", "country": "中国", "source": "seed", "confidence": 1 },
  { "slug": "jiumu", "name": "九牧", "aliases": ["JOMOO"], "categories": ["卫浴"], "tier": "premium", "one_liner": "国产卫浴龙头，龙头五金起家，智能马桶量大。", "country": "中国", "source": "seed", "confidence": 1 },
  { "slug": "jianpai", "name": "箭牌", "aliases": ["ARROW", "箭牌卫浴"], "categories": ["卫浴"], "tier": "premium", "one_liner": "国产卫浴一线，陶瓷洁具见长。", "country": "中国", "source": "seed", "confidence": 1 },
  { "slug": "huida", "name": "惠达", "aliases": ["HUIDA"], "categories": ["卫浴"], "tier": "mainstream", "one_liner": "老牌卫浴上市公司，主流档性价比选择。", "country": "中国", "source": "seed", "confidence": 1 },
  { "slug": "jianlin-zhijia", "name": "建霖智家", "aliases": ["建霖"], "categories": ["淋浴房", "卫浴"], "tier": "mainstream", "one_liner": "上市卫浴代工大厂旗下品牌，淋浴房/五金整装渠道常见。", "country": "中国", "source": "seed", "confidence": 1 },
  { "slug": "shengdu", "name": "圣都整装", "aliases": ["圣都家装", "圣都"], "categories": ["装修公司"], "tier": "premium", "one_liner": "杭州起家的整装公司，2021 年被贝壳收购；AEs/A5s 为其硬装全案套餐。", "country": "中国", "source": "seed", "confidence": 1 }
]
